{
  "run_id": "20260802-py-task-tracker-qoder-cli-deepseek-v4-flash-0731-01",
  "task_id": "py-task-tracker",
  "agent": {
    "harness": "qoder-cli",
    "version": "1.1.11",
    "model": "deepseek-v4-flash-0731",
    "params": {
      "context_window": 1000000,
      "thinking_effort": "max"
    }
  },
  "model_mismatch": false,
  "actual_model": "dfmodel",
  "human_intervention": 0,
  "started_at": "2026-08-02T05:43:12.501775+00:00",
  "ended_at": "2026-08-02T05:47:30.595001+00:00",
  "duration_s": 258.1,
  "usage": {
    "input_tokens": 48563,
    "cache_read_tokens": 766464,
    "cache_creation_tokens": 0,
    "output_tokens": 32258,
    "cost_usd": 0.036996,
    "cost_source": "price_table",
    "price_version": "2026-07-v1",
    "cost_model": "dfmodel",
    "credits_consumed": null
  },
  "tool_calls": 30,
  "turns": 24,
  "status": "completed",
  "prompt_sha256": "d6856e8498d4c89dd9d4e9a63c97f1cef213199e91b95b4eb816eeb2b1fe900c",
  "manifest_sha256": "0a777da4c6948dd64e404ea3015fa19520b2c186cad29726e2b387fa6a0abcc3",
  "notes": "模型一致: dfmodel；剔除 2 次辅助调用（model_key=lite，共 2369 tokens，如标题生成）",
  "process": {
    "planning": true,
    "plan_items": 0,
    "plan_completed": 0,
    "scope_adherence": 0.6,
    "self_test_after_last_edit": true,
    "self_test_kind": "framework",
    "retry_pattern_max": 0,
    "failed_tool_calls": 0
  }
}
