{
  "run_id": "20260802-py-task-tracker-opencode-deepseek-v4-flash-0731-01",
  "task_id": "py-task-tracker",
  "agent": {
    "harness": "opencode",
    "version": "1.18.11",
    "model": "deepseek-v4-flash-0731",
    "params": {
      "context_window": 1000000,
      "thinking_effort": "max"
    }
  },
  "model_mismatch": false,
  "actual_model": "deepseek-v4-flash-0731",
  "human_intervention": 0,
  "started_at": "2026-08-02T13:43:28.586000+08:00",
  "ended_at": "2026-08-02T13:53:50.251000+08:00",
  "duration_s": 621.7,
  "usage": {
    "input_tokens": 55080,
    "cache_read_tokens": 1345280,
    "cache_creation_tokens": 0,
    "output_tokens": 31131,
    "cost_usd": 0.053666,
    "cost_source": "price_table",
    "price_version": "2026-07-v1",
    "cost_model": "deepseek-v4-flash-0731",
    "credits_consumed": null
  },
  "tool_calls": 41,
  "turns": 21,
  "status": "completed",
  "prompt_sha256": "d6856e8498d4c89dd9d4e9a63c97f1cef213199e91b95b4eb816eeb2b1fe900c",
  "manifest_sha256": "9234104e4d0e95c9215e1cca34928ce914e62a1a49b088295f2d1ff5fc03d7e0",
  "notes": "模型一致: deepseek-v4-flash-0731",
  "process": {
    "planning": true,
    "plan_items": 5,
    "plan_completed": 5,
    "scope_adherence": 0.2,
    "self_test_after_last_edit": true,
    "self_test_kind": "framework",
    "retry_pattern_max": 0,
    "failed_tool_calls": 1
  }
}
